{
  "age_seconds_at_receipt": 873,
  "capture": {
    "artifact-after.json": "eyJpZCI6MTAzMjAzNTk0NzEsIm5vZGVfaWQiOiJNRGc2UVhKMGFXWmhZM1F4TURNeU1ETTFPVFEzTVE9PSIsIm5hbWUiOiJnb3Zlcm5hbmNlLXJlcG9zaXRvcnktc2VjdXJpdHkiLCJzaXplX2luX2J5dGVzIjo1NzY2LCJ1cmwiOiJodHRwczovL2FwaS5naXRodWIuY29tL3JlcG9zL2pva3UtZGV2L2RldnNlY29wcy1nb3Zlcm5hbmNlLWZyYW1ld29yay9hY3Rpb25zL2FydGlmYWN0cy8xMDMyMDM1OTQ3MSIsImFyY2hpdmVfZG93bmxvYWRfdXJsIjoiaHR0cHM6Ly9hcGkuZ2l0aHViLmNvbS9yZXBvcy9qb2t1LWRldi9kZXZzZWNvcHMtZ292ZXJuYW5jZS1mcmFtZXdvcmsvYWN0aW9ucy9hcnRpZmFjdHMvMTAzMjAzNTk0NzEvemlwIiwiZXhwaXJlZCI6ZmFsc2UsImRpZ2VzdCI6InNoYTI1Njo2NDIxYTA5YTg0ODZiZDFhY2M2YWM4NWM5MDNlZDk4NmZmZDE4ZDU5ZjgwOTk3NDZkYmVlOGVjMjliY2Y2NTg3IiwiY3JlYXRlZF9hdCI6IjIwMjYtMDktMTNUMTY6MzU6NTFaIiwidXBkYXRlZF9hdCI6IjIwMjYtMDktMTNUMTY6MzU6NTFaIiwiZXhwaXJlc19hdCI6IjIwMjYtMTItMTJUMTY6MzU6NDNaIiwid29ya2Zsb3dfcnVuIjp7ImlkIjozNDc2OTA1MzIyNSwicmVwb3NpdG9yeV9pZCI6MTMwMTM2OTQ2OCwiaGVhZF9yZXBvc2l0b3J5X2lkIjoxMzAxMzY5NDY4LCJoZWFkX2JyYW5jaCI6Im1haW4iLCJoZWFkX3NoYSI6IjFmY2RkZTlkODAzMDQ1MjhmYzFlNzY1MzE0ZTczMjE1OTM2YTg1MTIifX0=",
    "artifact-before.json": "eyJpZCI6MTAzMjAzNTk0NzEsIm5vZGVfaWQiOiJNRGc2UVhKMGFXWmhZM1F4TURNeU1ETTFPVFEzTVE9PSIsIm5hbWUiOiJnb3Zlcm5hbmNlLXJlcG9zaXRvcnktc2VjdXJpdHkiLCJzaXplX2luX2J5dGVzIjo1NzY2LCJ1cmwiOiJodHRwczovL2FwaS5naXRodWIuY29tL3JlcG9zL2pva3UtZGV2L2RldnNlY29wcy1nb3Zlcm5hbmNlLWZyYW1ld29yay9hY3Rpb25zL2FydGlmYWN0cy8xMDMyMDM1OTQ3MSIsImFyY2hpdmVfZG93bmxvYWRfdXJsIjoiaHR0cHM6Ly9hcGkuZ2l0aHViLmNvbS9yZXBvcy9qb2t1LWRldi9kZXZzZWNvcHMtZ292ZXJuYW5jZS1mcmFtZXdvcmsvYWN0aW9ucy9hcnRpZmFjdHMvMTAzMjAzNTk0NzEvemlwIiwiZXhwaXJlZCI6ZmFsc2UsImRpZ2VzdCI6InNoYTI1Njo2NDIxYTA5YTg0ODZiZDFhY2M2YWM4NWM5MDNlZDk4NmZmZDE4ZDU5ZjgwOTk3NDZkYmVlOGVjMjliY2Y2NTg3IiwiY3JlYXRlZF9hdCI6IjIwMjYtMDktMTNUMTY6MzU6NTFaIiwidXBkYXRlZF9hdCI6IjIwMjYtMDktMTNUMTY6MzU6NTFaIiwiZXhwaXJlc19hdCI6IjIwMjYtMTItMTJUMTY6MzU6NDNaIiwid29ya2Zsb3dfcnVuIjp7ImlkIjozNDc2OTA1MzIyNSwicmVwb3NpdG9yeV9pZCI6MTMwMTM2OTQ2OCwiaGVhZF9yZXBvc2l0b3J5X2lkIjoxMzAxMzY5NDY4LCJoZWFkX2JyYW5jaCI6Im1haW4iLCJoZWFkX3NoYSI6IjFmY2RkZTlkODAzMDQ1MjhmYzFlNzY1MzE0ZTczMjE1OTM2YTg1MTIifX0=",
    "artifact.zip": "UEsDBBQACAAIAHmELV0AAAAAAAAAAAAAAAAjAAAAZ292ZXJuYW5jZS1yZXBvc2l0b3J5LXNlY3VyaXR5Lmpzb27VW1lv20gSfvevKPDJAURZshMn1sAPRpJNgsVkDNuzi90kIFpkSexxq5vT3ZSjGeS/L/rgJVIHHcP2PgUR+6iqr6q6Lv99ABCoOMUFiZYoFRU8mEAwGh4PR8HAfCRKoVIL5DrSqwzN17lYouSExxhKzISiWshVqJDNQoVxLqleub2ZFDPKMKLJvbZ1E1Tt9ef+IW7zMMHlUYJLhbHIVFi7aibJAu+EvHW7xVShXGISEW32Ho+OT8PRWTg+uRmfTk5eTV6e/dctRD4TMkbDuFlobpU6EpytWt+jOCV8jhHJdSok/QsNWTPCFLorlygJY5HSROfKHDajPKF8rtxJKl8siFwFE/j7AAAgiCXVKCkJJjA+HbjfMqLM1tf+vzNCWTCBs0G1g8aEReb3XKJZeuK/pXSe1n8/PQD44SRJ1a2lquTyDMQMxqfQAAUKeoBIBC404JImyGNMgChQRFM1o5hM4MPVdTgavYLDazrnmICTiwKJf+ZUYgKCg04REpyRnGmYSsLj9MUvfuMpHF5jLFGDignnlM8BOZkyTMolr8slWa5SyKTQGGsqeGvlGzh8hxlyQ+gKCEOpFRCeQMlWniVEo1rfOR7B4U1KZRJmROoVfKD6Yz6FC3uNgoxyw5oWMMsZg1gsFlTD9ccLVR4wNlc7Ds2F+D1jNKYajBbOmLiDDOWCKmXPk6i0pLGuEXAChxe5FgtiGTOiEJ5fkaG0vxIGCdEEEiox1mxl6Nks2fFLOPxQmgRIZEgUgiZzZTGN5SrTYi5JlhotYitYoqQG0/KEUzhcE0RFuLmcZJkUS0xAiVzGqF4M4QqXFO8sWc7qiNtoZCJxgQl1DCqNmYIpMnE3dBZRM4AvVomdYQAEzuIdwuNgUPx8i8Z8As995LiPvHZgUi3UVDPrw941BAUdSxUaIWh7cGFf1Vf8nrn1E9Ayx2pXaeTWYsvfC7+zvj5B7Uw5WCf63KyrXehtLpI4U6Vg7Kc51Wk+nbgDUB0tCOVHlWmUZ1RLZc5QoVaB//LN/vtjsFnYxy1hZzljkbFsVDqSFuuoMPQOgV8aa/HLrQo4jTFG7jZDe/NjQ1BQEJW0ecbU+fjZIHHSQqJ67aKYbsOg5gPefgKqgFSu2UkN4hTj22eAgDsisuSo8y9fgwtO2OovhMuVTgX/Ggzga52fqzIqgGvv4N2aJWHU+PmQ8CR0r/jX4NtDozl0a48KF6+OaiFITIerBdsf4Zcdjk1pmceaLrFwbv5tjaZMxLedaP/DxCf23UDndL2vS5ChdbytrY+Nto2gIkNhwYZ1eoOSxMbPz8YCX7XwUTbeKTHZYoK9IqNuZExA1wcVGyt2oVKGqGuwbODm3K5/CBSOKjOnc060jUwfApnTNjI2WoyKgDLywV4XMt2h58NZR38cmrSffxa8l/irTOmoCHojwpOIGFeqaA+5vt4kV2u7FbC7xbshbH8+Ul5n6Qml/qbjHSgymqg8e7PI++U/T+RsHEtkKnTFkqfMit48BuWKWPAZnUeZRIVc934VdkLT8aJXt/d7xM9a4MUiwUrNHCt59yvxViRYeaKupT+DUd9n2hD+J4uK2Ka/+NvRkTuyl0THo5ZEtUnTI5umR8SlpZFKSeRy9A653iuvfyLDyLkjycrzfDSAgjOXlvg3me/rndoYdLy4XohHtQLF/vi08/FKY6rzoqpusCUt71M3eTLHZUn1Tqog9nx8djQ+6+OUOmRegrQ9xdgfmnb2XlYMM6JTFYm7boN565dBlc6A3QEpWWIFkdkvH8hS+ronKzXjURssnX/ZL8krxPr2t3fvf/v35/dX1/uLtZ2KE1e3wyQyIW90ZwpZKiJT4y87xPswZb4nDJ4cYTVmy1fCJu1tnWV0hvEqZhhmlAkduqfePAT7ZuU/YwftzNrXQiNTC42Kquf20kmP8umTPR0FAVGdP4MIkXFKTWibSwynRCGjHEM2Dpej4Xg4cjUTNq4+LcfD8fDE11LsmjDLp4zGIUlEZpS0/Hbc9W3vUsvEkxoaUuuOz//eB+d2hp5JuiQao2XOOEoypcwEf64etD0vvHQ7obETyp2mjPagEXRf97eDs95Bsj8vbJwXlufVkbl+//b3q083/xkukv2xaefoRe/Ax3CRbyFsjxR6dSOeyA4JY+Ku5Ev1TiV3h2MHAN/MgQHH7zqynZR20ySTVBQ8X446ZPkrnUuj4uXrBe7hAnJHVjCTYuFfIDCO3pcUq3NIkkg0beImE8UbWVA8qOhBG78qc4fZU31yHBuarjBjJEagXJNbtAGh0cCZYFTAnOqisHlHdeo7CJjA1D6hVadBgZBAQGFGDIdsVXV6Gq9sgQUoLSQO4Z+IGXAhzeO8xHr0I3KtaIL2GSbV820FBr4DrFfDmnTiGDPtqvNVXyv4LIDYgm4V3sZiMaUclUn4NHKtJv5Yy2PBc3cMMAw6DW8n9O9dGxvoYpFr48WaeRFInKE0ktkX71HdQRQWfz8V+Jd5xEztgrVEVZFlWolWKcv8rVSG9URuUHqJ0m3UfYV9ulSKUg2MgIvaFNSGFRgukZmzwCdiu3G+SWtkm5QeUqKACyjkrWs5acXWANach3lnFDKrugNrDh4o55lVZ3po+vPGme2jHeMO7bhCaw/FBIDgE9hZJt2mHaP7qoLvJe9ZxxmU/WWstZ8xgTnJ4LCrrPrCiTQWzEgYCMwkqhSq4ZfdQF/4PbVedzkboXZPONj7DbGlrEtkTUTw8AjurMRuBfL18wOys3L7SMDunkt5PHzvW/bdivebR8K7u+y6XQ9+toT8SDrSfyLpMXXmZ+puWwOC8YNozrYqWaU1VU1gl8Zsrt09jjbce0jsAXTiuFMnbMQAqtmfFtyG/Hs6iVd7QL1HflDXgTlVGiWQOBY5dwFTmi8IdyNEVfxt6LbZeIJcU01NBFWMfoDE2ATwK4csSZwAHauhDxBNs7kIrascYT3I3oX877wQoD3V1Yck/uFOs5mUjVY99X5cdF3qPqS1CcqU7RW9dWH6iWspkjzGsh5V1q5cmYY0RiK2m/HL/th26UOF7aULt2GWm1oUFAUnV1bTqRT5PAUDdA16L6eSCyliVD4HdDw6nsp87hdIhB1ZlehSqZQa32dL2v6UxN1oUgiTcO6RuRmvVCWETcKXLmdplwS92VJZUU/iW+Lg1gZuq65uAEvlC/c02NTE3lMoQZnx15xLNTr8U8PRPcajjXQyGqGUQtahD+bpBK7QlV2s4I0QlaIGvenKZPM4d1k3HH68ubmEl6OTF5XI/x+3H9Q0vAZACQpAsKSKukKam5w0xldd2xxbtS2Nhs9tjbOuVag2jy2aCfL2ssZsXdNum1N2jVR+66xdfWXHxF3bD7RHv9oVzuYMWKsut2Hmypfj6i4zKMPCGfppoxo4a2lEMAGeMzbY8Hk9y1hfviUY3bK0GZWus7qhAb++bEcl2C9vCMaHVXVxrNUdWuLoKDO0GXMK3dX/XV8bE+711qhDa6S4tb48074KRsHP6iVcG0Q1+s0d6+pzA402ezMW3dLc2tWS2tzmaptCrQ5ZzFHvfY+rjoaNro5ElTM3rbK1fez3Fk9lqGWu9t/W+Gue/S4s67eh80Abxz8C105OaVZXzA1a393+tUg2ziw6Yc6LO1dcnl1vkzVlvqNhVue43TZruMXO5tnaio4WWlthNrT3nivdZdzi/uoowZgq69dFzpPGHz5ZT68abkA12ytB5e7LQEeh1vavqTatdGFeVPCoak/Ej4MfB/8DUEsHCK7lYun5CgAABDcAAFBLAwQUAAgACAB5hC1dAAAAAAAAAAAAAAAAIQAAAGdvdmVybmFuY2UtcmVwb3NpdG9yeS1zZWN1cml0eS5tZMVZW28buxF+168YJC8OICla3xIr8IPrXI5Pe2LXSnuAHhRaijurZcMltyRXjgr/+GLIveri2G6CPgSIteRwON9w5uPHl/BJr9AopjjCLRbaCqfNGmYo09EMeWmEW8OFtWhtjsoNBtcLi2aFyRTiw8nh6WhyNoqOvkSn06OT6fHZP+LB4OVL+PANeenECntTz0CnEJ2CJeO2Ns6NcGgEA2YQlHaAK5Gg4pgAs2CZEzYVtN6n29loMjmBg5lYKkyAZ0wt0YLBf5fCYAJagcsQEkxZKR0sDFM8e/WumngKBzPkBh1YzpQSagmo2EJi0gx50wwpSptBYbRD7oRWWyPfwsF7LFCRo2tgEo2zwFQCzbbKImEO7ebMaAIHXzJhklHBjFvDJ+F+KRdw4ZexUAhFW3Ma0lJK4DrPhYPZLxe2MRDR0mGHtCB+K6TgwsGdNl9Tqe+gQJMLa709g9YZwV3HgSM4uCidzpnfGIVCV/vVBRr/K5OQMMcgEQa5k2vyZ39ko2M46GSRQYnMIji2tB5TbtaF00vDikxwJuUaVmgEYdpYOIWDjUC0jtPirCiMXmECVpeGo301hltcCbzzbmmfkixMpJgYzDERYYPWYWFhgVLfjQeDL5mwICwwKLRQbiTUyIkch2Cw0MaNtJJrYE3OUsLSCqY9GS5jjgIhFPrFBokgTxclgb1swjCGK0cLUXBZmxUcjROp4ME3bYApYKXLtBH/Cb85PbB3wvEMuFa2zNHQsI4DqFJtOHr3nIaF1PwrJXOuExz70/ceuSD4YeaYw8FgBNcrNExKsI650k4hToVKhFraeDCCD63BKcQhEHMKxMbH6sA1/voakDJpkQZeVsd4CnF0Sj/cUBhpyBv66yMT0v91Vg+mXICUCVkaJJeO6MMvYpl1fzwN9eRSK2e0tHBZGoOKUvJDXSVof3E4lVE8hfe9HK3PMCbtqMN4Cjd0uqhwoA3HKGQYxdGExKqrSjvvKJ52q+XlVUikpvyE4ALPkH9tZx3HU/hIIfRnLORM7VyCEj3oHsTuWmfxFC51gm2t4lqlYll2PYpoJ00o29yDgrnMQsZW2JYHfafQ2HbuCUXBiBVzCKtSKjRsISTlaMgAWlM05cujcF2ggo9V5gwG93D1Hu5hhnSc3Rru629wX+PUPZpwP7gfjUa9f4P7esMnMdxDnIllRv95UoWnidZPmFcT5vWE85Ce0Fno1C/Eq6j5xXZ3BW/Wf5rXn84/a9W39maftT0NZIfROQ2dt0O3F3nbi83T+g7NTPwMttBuXg+bV8P8YkPojAh5Ni8MWlTu3Jmy50w06TnzrFZGBkoVvs8NpvZ8MgSbsTn9RBFp4FMboYiijVA8vQ+GgPh51ebrmefR2evorLfc0Ra8P6Z1eif8iHnOhJrfUfGc157b8z9ejJfCZeXidfPbaylS5GsucVQIqd0oIDhe5/LFP3tOH/di9LzOHCCq/5pXM+c08/yPF8zwTFC6lgZHC2ZRCoUjGY1Wk3E0nrwYwgsZtR9W0TgaH9Gv4fuoKBdS8BFLdEExq74c7vjS39lpf2dPYQw0kUmp7zCZszCjOWhU226REpQOVgKf8ZuDGfEG+vQSojH8JpaGKiUL8GMCHjIL7I6tITU6rxAHwrMu9QfxzSR+RQ3qIkkMEq2YtqlFPdKgz3VLtqZA6U6DvX9T4uOScQShHPuKPsupMqdaCg1L4epl7oTLqraFCSx8TrbtzXqaARYLRluQ67Yn9tK2pt1gnTY4hj8jFqC0oWxfYbe96NJZkaDPa9aeBx+Rmh249djvhGPh/CTe8IPPGgiBFbZHlet84QkV18qhcnZaWfNbq7e6+yyNA0iH45qrgMjz0lH166cIGEzR0BYfRmYSD9uE+y5If6czQqVYbu2qs57BkBdNTWzg2iyOwyaRm8zuprM/IDZDY4cUi7qxdAjiSOIKJdmCqp7uReJL1vGW+hFkjCgr1PFznfLe7mYIGyeJiIJF6XNq6PO0CnygEnZncafbHXWXCr8jovQ+9WoHKbr7evNBfBPtwW/yCNCqy0OosdM2dq+b/shUMmeKybUVHpJwocDOfQMTWLICDnZxhFchClxLCgowSA3arHOx2AvJRTW0S5zqO7D9/k3WL0s+NjFsMCiYtVWsjx+K9T7m8lDI3/xfQ76TQf1cCL6vFDwOiZOdSDyR4j2EzNsfj0xNTVrSSCTkYcT+Vwr6c9F8uprzOHRP96D7DNb6AMZR9FSMq7L9urNWQzRbfFvq+T1s97Ppn4rbs6Wwx6H3htDzvQps/z6qVaB5B/HN4b6Dd7IDlC71a5FZCuvQAONclyr03azMSRgiXaLlV+SEv5UnqJxwghrxiklBmQkGORG0dYg3S8L+gt+jil6Yklp64FAtB9xkU3vw+Juqg+CNhQuEwX8FI54B+5hUTlcK0WbkKh7keedC1r3/7RiuSOBJSo7tFaS+roQ7QYjBAxGPjvdGPIBRR/wmUChIS7q/QH1NCdcilxldLjOvy3UAqbbRuGQ0R1sx7+Bw5WDNot9Bor34ZzAw2UxQIfBKTWUlCSsSLSSav58v08Ft2Xff31Wgn9s3uSrFhWmdZvwrCyA4AsHnTpCrbJmHgudZZhAwK+EtLyQ6bOS9XbLPLAhf9/Ug0nqgfifYJfv0pZ9o65Id0ynsXvA3xTwas6lMTA7323m83LfT8rYM0Fh+rCC40+7xfruPlQx32u2LaTHpqc9S1R6jnrXW98to23a2dbNNOw8IaNvm3u7e8NOlsm3TZ33TNT77xNldeGxoZo17zxbPtrzc0MU6AXieQLa9wOGeMDxJfd4ZnB2Hq3b/x4lt2xs63h2x58tl20uc7I7Z41X3nfE63eP4U9Wwxl//YFuLP38tmXfnQiXwF5ELF57VqON27vTVU5RFRx5X0QkcDxOQpILUjbQSiTLiLNwrZ7WnN1fU8n5vsjHoA0O4vH7/4fr3zx9uZ8NaVAti27B63NuARShbdFiI53VUcnUZ2OXNFaAx2tSUhZofJtR3aeivs+vPXZI5hguIj6k0awUMJC4ZX1eZNGrr0QAAVeIfESHRGB76FC4J2G7VssQfSLBJYLH2C2KaYhCKqvQkWmbR2XcDgFKxFRPScw6W5ELR42IQ4PqvnNVbeWG0f6Jknlsj84xGWEiE9RnkA+BJLWVWR28L9ao6W03b9r+b3G4MCDcxjsPwnLnwf4BOKQhEOkEQSyA6H8b3Mntc6asBNcqry/ph8yovGHeUW7c1JXqPqxny6yKU6q7Q3BKfhshQFEoV+pnfamO5ETNJUDSMV6W/+3ZK76U7TNz6cwiWZ5gziL0sHROhFoSCXJMaG5gq9XrrTOm96z86F5IpMvZZt17XeSs6nTfVhjQ22z39uT+q4W7Ue839ky5Vwsy6esXuvFI3Bvz7tX96bnISE+HqI1ef12FgD32ZeDio3ncbelq7bodeQq5JfUcEX6z9fQl+EyHBmrA3HmEyYBSo1L//tqk2HvwXUEsHCBooq1w3CgAAeyIAAFBLAQItAxQACAAIAHmELV2u5WLp+QoAAAQ3AAAjAAAAAAAAAAAAIACkgQAAAABnb3Zlcm5hbmNlLXJlcG9zaXRvcnktc2VjdXJpdHkuanNvblBLAQItAxQACAAIAHmELV0aKKtcNwoAAHsiAAAhAAAAAAAAAAAAIACkgUoLAABnb3Zlcm5hbmNlLXJlcG9zaXRvcnktc2VjdXJpdHkubWRQSwUGAAAAAAIAAgCgAAAA0BUAAAAA",